<!ELEMENT menu (entrantes, platos_principales, postres)>
<!ELEMENT entrantes (plato+)>
<!ELEMENT platos_principales (plato+)>
<!ELEMENT postres (plato+)>
<!ELEMENT plato (nombre, descripcion? , precio, alergeno*)>
<!ELEMENT nombre (#PCDATA)>
<!ELEMENT descripcion (#PCDATA)>
<!ELEMENT precio (#PCDATA )>
<!ELEMENT alergeno (#PCDATA)>
<!ATTLIST plato codigo ID #REQUIRED>
<!ATTLIST plato vegetariano (si) #IMPLIED>
<!ATTLIST precio moneda CDATA #IMPLIED >
